{
  "$schema": "https://json-schema.org/draft/2020-12/schema",
  "title": "data/about.json: el texto del about",
  "description": "data/about.json: el texto del about, una lista de párrafos por idioma. Este fichero lo lee VS Code (por el \"$schema\" de arriba del JSON) para autocompletar, explicar cada campo y subrayar lo que está mal; el build valida con él mismo.",
  "type": "object",
  "additionalProperties": false,
  "properties": {
    "$schema": {
      "type": "string"
    },
    "_": {
      "type": "string"
    },
    "en": {
      "$ref": "#/$defs/parrafos"
    },
    "es": {
      "$ref": "#/$defs/parrafos"
    },
    "ca": {
      "$ref": "#/$defs/parrafos"
    }
  },
  "$defs": {
    "parrafos": {
      "type": "array",
      "description": "Una lista de párrafos: [\"primero\", \"segundo\"].",
      "items": {
        "type": "string"
      }
    }
  }
}
