{
  "_": "El texto del about, uno por idioma, como una lista de párrafos: [\"primero\", \"segundo\"].",
  "en": [
    "i design using light and visuals, mostly for live music. i come from 3d and animation oriented towards videogames but my focus is on the live experience. i've also worked as creative director for artists and from time to time i research interaction in art and new media. the title that best describes my work is technical artist, because i use my technical knowledge and abilities to find solutions and realize my creative vision.",
    "barcelona"
  ],
  "ca": [
    "dissenyo a través de la llum i els visuals, sobretot per a música en directe. vinc del 3d i l'animació per a videojocs, però he reorientat els meus coneixements al món de les experiències live. també he treballat com a director creatiu per a artistes i de tant en tant faig recerca artística sobre la interacció i els nous mitjans. el títol que millor descriu la meva feina és el de technical artist, perquè utilitzo els meus coneixements i habilitats tècniques per a trobar solucions i poder dur a terme la meva visió creativa.",
    "barcelona"
  ],
  "es": [
    "diseño a través de la luz y los visuales, sobre todo para música en directo. me formé en 3d y animación para videojuegos, pero he reorientado mis conocimientos al mundo de las experiencias live. también he trabajado como director creativo para artistas y de vez en cuando hago investigación artística sobre la interacción y los nuevos medios. el título que mejor describe mi trabajo es el de technical artist, porque uso mis conocimientos y habilidades técnicas para encontrar soluciones y poder llevar a cabo mi visión creativa.",
    "barcelona"
  ]
}
